{
  "$schema": "https://json-schema.org/draft/2020-12/schema",
  "$id": "https://sinetti.ai/schemas/settlement-event",
  "title": "SettlementEvent",
  "description": "One supervision-feed record per settled deal, mirroring the on-chain Settled event. seller_credit and buyer_credit are per role address and total: any challenger-bond routing is already inside the winning party's figure, and the challenger's identity comes from the Challenged event. Every settlement is reconstructable from events only; no contract state reads are needed.",
  "type": "object",
  "additionalProperties": false,
  "properties": {
    "deal_id": {
      "type": "string",
      "pattern": "^[0-9]+$"
    },
    "reason": {
      "type": "string",
      "description": "The Settled.reason recorded by the escrow for this settlement path.",
      "enum": [
        "accepted",
        "verdict_pass",
        "verdict_fail",
        "verdict_inconclusive",
        "ruling_release",
        "ruling_refund",
        "ruling_lapsed",
        "timeout",
        "cancelled"
      ]
    },
    "seller_credit": {
      "type": "string",
      "pattern": "^[0-9]+$",
      "description": "Integer token base units credited to the seller's address on this settlement, including any returned seller bond and any challenger-bond routing."
    },
    "buyer_credit": {
      "type": "string",
      "pattern": "^[0-9]+$",
      "description": "Integer token base units credited to the buyer's address on this settlement, including any slashed seller bond and any challenger-bond routing."
    },
    "token_address": {
      "type": "string",
      "pattern": "^0x[0-9a-fA-F]{40}$"
    },
    "tx_hash": {
      "type": "string",
      "pattern": "^0x[0-9a-fA-F]{64}$"
    },
    "block_number": {
      "type": "integer",
      "minimum": 0
    },
    "challenger_address": {
      "type": "string",
      "pattern": "^0x[0-9a-fA-F]{40}$",
      "description": "Present when the path was challenged; the address that posted the challenger bond, read from the Challenged event."
    },
    "bond_slashed": {
      "type": "string",
      "pattern": "^[0-9]+$",
      "description": "Integer token base units of seller bond slashed to the buyer. Present only on ruling_refund, the single path on which the seller bond ever slashes."
    }
  },
  "required": [
    "deal_id",
    "reason",
    "seller_credit",
    "buyer_credit",
    "token_address",
    "tx_hash",
    "block_number"
  ]
}
